{
    "status":0,
    "msg":"ok",
    "se_query":"原始query", 
    "logid":"xxxx1234354", 
    "id":"id12334235",
    "user_id":"",
    "cuid":"",
    "ctime":1482226019,
    "result":{
        "cards":{},
        "intent":{},
        "speech": {
            "type": "Text",  
            "content": "为您播放周杰伦的歌曲"
        }
    }
}

